{
  "ontology": {
    "id": "mif-base",
    "version": "0.1.0",
    "description": "MIF base ontology with cognitive triad namespace hierarchy",
    "schema_url": "https://mif-spec.dev/schema/ontology/ontology.schema.json"
  },
  "namespaces": {
    "_semantic": {
      "description": "Facts, concepts, relationships - declarative knowledge",
      "type_hint": "semantic",
      "children": {
        "decisions": {
          "description": "Architectural choices with rationale",
          "type_hint": "semantic"
        },
        "knowledge": {
          "description": "APIs, context, learnings, security - factual knowledge",
          "type_hint": "semantic"
        },
        "entities": {
          "description": "Entity definitions - technologies, components, systems",
          "type_hint": "semantic"
        },
        "preferences": {
          "description": "User preferences, settings, configuration choices",
          "type_hint": "semantic"
        }
      }
    },
    "_episodic": {
      "description": "Events, experiences, timelines - autobiographical memory",
      "type_hint": "episodic",
      "children": {
        "incidents": {
          "description": "Production issues, outages, postmortems",
          "type_hint": "episodic"
        },
        "sessions": {
          "description": "Debug sessions, work sessions, meeting notes",
          "type_hint": "episodic"
        },
        "blockers": {
          "description": "Impediments, issues preventing progress",
          "type_hint": "episodic"
        }
      }
    },
    "_procedural": {
      "description": "Step-by-step processes - skill-based knowledge",
      "type_hint": "procedural",
      "children": {
        "runbooks": {
          "description": "Operational procedures, SOPs, playbooks",
          "type_hint": "procedural"
        },
        "patterns": {
          "description": "Code conventions, best practices, testing strategies",
          "type_hint": "procedural"
        },
        "migrations": {
          "description": "Migration steps, upgrade procedures, data transformations",
          "type_hint": "procedural"
        }
      }
    }
  },
  "entity_types": [],
  "traits": {
    "timestamped": {
      "description": "Adds creation and update timestamps",
      "fields": {
        "created_at": {
          "type": "string",
          "format": "date-time",
          "description": "When the memory was created"
        },
        "updated_at": {
          "type": "string",
          "format": "date-time",
          "description": "When the memory was last updated"
        }
      }
    },
    "confidence": {
      "description": "Adds confidence score for memory decay",
      "fields": {
        "confidence": {
          "type": "number",
          "description": "Confidence score (0.0-1.0)"
        }
      }
    },
    "provenance": {
      "description": "Adds source tracking",
      "fields": {
        "source": {
          "type": "string",
          "description": "Where this knowledge came from"
        },
        "author": {
          "type": "string",
          "description": "Who captured this memory"
        }
      }
    }
  },
  "relationships": {
    "relates_to": {
      "description": "General association between memories",
      "from": [],
      "to": [],
      "symmetric": true
    },
    "supersedes": {
      "description": "Newer memory replaces older one",
      "from": [],
      "to": [],
      "symmetric": false
    },
    "derived_from": {
      "description": "Memory was derived from another",
      "from": [],
      "to": [],
      "symmetric": false
    }
  },
  "discovery": {
    "enabled": true,
    "confidence_threshold": 0.8,
    "content_patterns": [
      {
        "pattern": "\\blet'?s use\\b|\\bdecided to\\b|\\bwe will use\\b",
        "namespace": "_semantic/decisions"
      },
      {
        "pattern": "\\bgoing with\\b|\\bchose\\b|\\bpicked\\b",
        "namespace": "_semantic/decisions"
      },
      {
        "pattern": "\\bthe plan is\\b|\\bour approach\\b",
        "namespace": "_semantic/decisions"
      },
      {
        "pattern": "\\blearned that\\b|\\bturns out\\b|\\bTIL\\b",
        "namespace": "_semantic/knowledge"
      },
      {
        "pattern": "\\brealized\\b|\\bthe fix was\\b|\\bthe solution\\b",
        "namespace": "_semantic/knowledge"
      },
      {
        "pattern": "\\bdon'?t forget\\b|\\bremember this\\b",
        "namespace": "_semantic/knowledge"
      },
      {
        "pattern": "\\bshould always\\b|\\balways use\\b",
        "namespace": "_procedural/patterns"
      },
      {
        "pattern": "\\bconvention\\b|\\bbest practice\\b",
        "namespace": "_procedural/patterns"
      },
      {
        "pattern": "\\bblocked by\\b|\\bstuck on\\b",
        "namespace": "_episodic/blockers"
      },
      {
        "pattern": "\\boutage\\b|\\bincident\\b|\\bpostmortem\\b",
        "namespace": "_episodic/incidents"
      },
      {
        "pattern": "\\brunbook\\b|\\bplaybook\\b|\\bSOP\\b",
        "namespace": "_procedural/runbooks"
      }
    ],
    "file_patterns": [
      {
        "pattern": "auth|login|session|jwt|oauth|token",
        "namespaces": [
          "_semantic/knowledge",
          "_semantic/decisions"
        ],
        "context": "authentication"
      },
      {
        "pattern": "api|endpoint|route|controller|handler",
        "namespaces": [
          "_semantic/knowledge",
          "_semantic/decisions"
        ],
        "context": "API design"
      },
      {
        "pattern": "db|database|model|schema|migration|sql",
        "namespaces": [
          "_semantic/decisions",
          "_procedural/migrations"
        ],
        "context": "database"
      },
      {
        "pattern": "test|spec|mock|fixture",
        "namespaces": [
          "_procedural/patterns"
        ],
        "context": "testing"
      },
      {
        "pattern": "config|settings|env",
        "namespaces": [
          "_semantic/decisions",
          "_semantic/knowledge"
        ],
        "context": "configuration"
      },
      {
        "pattern": "deploy|docker|kubernetes|helm|ci|cd",
        "namespaces": [
          "_procedural/runbooks",
          "_semantic/decisions"
        ],
        "context": "deployment"
      },
      {
        "pattern": "security|encrypt|hash|sanitize",
        "namespaces": [
          "_semantic/knowledge",
          "_semantic/decisions"
        ],
        "context": "security"
      },
      {
        "pattern": "service|component|module",
        "namespaces": [
          "_semantic/entities",
          "_semantic/decisions"
        ],
        "context": "components"
      }
    ]
  }
}
